{
  "schema_version": "prefer.client-contract.v1",
  "contract_version": "1.0.0",
  "title": "PreFer narrow llama.cpp router client contract",
  "scope": {
    "promised": [
      "GET /v1/models minimal discovery envelope",
      "POST /v1/chat/completions non-streaming minimal envelope",
      "POST /v1/chat/completions SSE streaming chunks terminated by data: [DONE]",
      "OpenAI nested json_schema request form used by Ground Control",
      "conditional OpenAI function-tool call envelope and role=tool result message",
      "versioned configured model identities plus measured router/discovery identifiers and aliases listed in this fixture",
      "OpenAI-shaped error envelope for rejected contract requests"
    ],
    "not_promised": [
      "full OpenAI API compatibility",
      "endpoints other than /v1/models and /v1/chat/completions",
      "Anthropic translation or /v1/messages",
      "built-in /tools endpoints",
      "parallel tool calls or tool-choice quality",
      "a fixed server-side request-byte limit",
      "server-side cancellation after a client closes a stream",
      "exact HTTP error codes, error messages, timing extensions, or router metadata"
    ]
  },
  "endpoints": {
    "models": {
      "method": "GET",
      "path": "/v1/models",
      "success_status": 200,
      "required_response": {
        "type": "object",
        "data": "array of objects containing a non-empty string id"
      }
    },
    "chat_completions": {
      "method": "POST",
      "path": "/v1/chat/completions",
      "required_request": ["model", "messages"],
      "non_streaming": {
        "required_response": ["id", "object", "created", "model", "choices"],
        "choice_required": ["index", "message", "finish_reason"],
        "message_required": ["role", "content"]
      },
      "streaming": {
        "content_type": "text/event-stream",
        "event_prefix": "data:",
        "chunk_object": "chat.completion.chunk",
        "termination": "data: [DONE]"
      }
    }
  },
  "structured_output": {
    "request_shape": {
      "response_format": {
        "type": "json_schema",
        "json_schema": {
          "name": "non-empty identifier",
          "strict": true,
          "schema": "JSON Schema object"
        }
      }
    },
    "response_rule": "choices[0].message.content is a JSON string that validates against the supplied schema",
    "semantic_rule": "schema validity and semantic anomaly classification are separate results"
  },
  "tools": {
    "status": "conditional-envelope-only",
    "request": "OpenAI tools array with function definitions; tool result messages use role=tool and tool_call_id",
    "response": "When a model emits tool_calls, each call has id, type=function, function.name, and JSON-string function.arguments",
    "not_promised": [
      "that a model chooses a tool",
      "parallel_tool_calls",
      "tool execution",
      "tool semantic correctness"
    ]
  },
  "errors_and_limits": {
    "rejections_tested": [
      "malformed JSON",
      "missing model",
      "unknown model id or alias",
      "malformed structured-output request",
      "malformed tool definition"
    ],
    "error_envelope": {
      "required": ["error"],
      "error_required": ["message", "type"]
    },
    "timeout": "The harness always applies a client deadline and records timeout; PreFer does not promise a server deadline.",
    "cancellation": "The harness closes the client SSE connection and records bounded return; backend work cancellation is not promised.",
    "request_size": "PreFer configures no stable byte limit. The harness caps generated payloads for safety and records backend rejection if tested.",
    "context_limit": "Context limits are preset/model dimensions. Unsupported or unrun 8K/32K/128K cells are explicit skipped or unsupported results."
  },
  "model_identity_rule": "canonical_id is the configured cross-system/preset identity. discovery_id is the normalized /v1/models and request identity measured on b9843 and carried forward to b11058 pending direct discovery smoke; listed aliases are configured request routes. When canonical_id and discovery_id differ, canonical_id is not promised as a PreFer request route until measured on that runtime.",
  "models": [
    {
      "canonical_id": "unsloth/gemma-4-26B-A4B-it-qat-GGUF:UD-Q4_K_XL",
      "discovery_id": "unsloth/gemma-4-26B-A4B-it-qat-GGUF:Q4_K_XL",
      "aliases": ["gemma-4", "gemma-4-26b-a4b"],
      "quantization": "UD-Q4_K_XL",
      "presets": ["8gb.ini", "12gb.ini", "12gb-pascal.ini", "96gb.ini", "aws/g6e/xlarge/general.ini", "aws/g6e/xlarge/gemma.ini", "aws/g6e/xlarge/gemma-26b-a4b.ini", "aws/g7e/2xlarge/general.ini", "aws/g7e/2xlarge/gemma.ini", "aws/g7e/2xlarge/gemma-26b-a4b.ini"]
    },
    {
      "canonical_id": "unsloth/gemma-4-E2B-it-qat-GGUF:UD-Q4_K_XL",
      "discovery_id": "unsloth/gemma-4-E2B-it-qat-GGUF:Q4_K_XL",
      "aliases": ["gemma-4-e2b"],
      "quantization": "UD-Q4_K_XL",
      "presets": ["8gb.ini", "12gb.ini", "12gb-pascal.ini", "96gb.ini", "aws/g6/xlarge/general.ini", "aws/g6/xlarge/gemma-e2b.ini", "aws/g6e/xlarge/general.ini", "aws/g7e/2xlarge/general.ini"]
    },
    {
      "canonical_id": "unsloth/gemma-4-E4B-it-qat-GGUF:UD-Q4_K_XL",
      "discovery_id": "unsloth/gemma-4-E4B-it-qat-GGUF:Q4_K_XL",
      "aliases": ["gemma-4-e4b"],
      "quantization": "UD-Q4_K_XL",
      "presets": ["8gb.ini", "12gb.ini", "12gb-pascal.ini", "96gb.ini", "aws/g6/xlarge/general.ini", "aws/g6/xlarge/gemma-e4b.ini", "aws/g6e/xlarge/general.ini", "aws/g7e/2xlarge/general.ini"]
    },
    {
      "canonical_id": "unsloth/gemma-4-12B-it-qat-GGUF:UD-Q4_K_XL",
      "discovery_id": "unsloth/gemma-4-12B-it-qat-GGUF:Q4_K_XL",
      "aliases": ["gemma-4-12b"],
      "quantization": "UD-Q4_K_XL",
      "presets": ["aws/g6/xlarge/general.ini", "aws/g6/xlarge/gemma-12b.ini", "aws/g6e/xlarge/general.ini", "aws/g7e/2xlarge/general.ini"]
    },
    {
      "canonical_id": "unsloth/gemma-4-31B-it-qat-GGUF:UD-Q4_K_XL",
      "discovery_id": "unsloth/gemma-4-31B-it-qat-GGUF:Q4_K_XL",
      "aliases": ["gemma-4-31b"],
      "quantization": "UD-Q4_K_XL",
      "presets": ["aws/g6e/xlarge/general.ini", "aws/g6e/xlarge/gemma.ini", "aws/g6e/xlarge/gemma-31b.ini", "aws/g7e/2xlarge/general.ini", "aws/g7e/2xlarge/gemma.ini", "aws/g7e/2xlarge/gemma-31b.ini"]
    },
    {
      "canonical_id": "unsloth/Qwen3.5-9B-GGUF:UD-Q4_K_XL",
      "discovery_id": "unsloth/Qwen3.5-9B-GGUF:Q4_K_XL",
      "aliases": ["qwen-3.5", "qwen-3.5-9b"],
      "quantization": "UD-Q4_K_XL",
      "presets": ["aws/g6/xlarge/general.ini", "aws/g6/xlarge/qwen-9b.ini", "aws/g6e/xlarge/general.ini", "aws/g7e/2xlarge/general.ini"]
    },
    {
      "canonical_id": "unsloth/Qwen3.6-35B-A3B-MTP-GGUF:UD-Q6_K_XL",
      "discovery_id": "unsloth/Qwen3.6-35B-A3B-MTP-GGUF:Q6_K_XL",
      "aliases": ["qwen-3.6", "qwen-3.6-35b-a3b"],
      "quantization": "UD-Q6_K_XL",
      "presets": ["8gb.ini", "12gb.ini", "12gb-pascal.ini", "96gb.ini", "aws/g6e/xlarge/general.ini", "aws/g6e/xlarge/qwen.ini", "aws/g6e/xlarge/qwen-35b-a3b.ini", "aws/g7e/2xlarge/general.ini", "aws/g7e/2xlarge/qwen.ini", "aws/g7e/2xlarge/qwen-35b-a3b.ini"]
    },
    {
      "canonical_id": "unsloth/Qwen3.6-35B-A3B-MTP-GGUF:UD-Q4_K_XL",
      "discovery_id": "unsloth/Qwen3.6-35B-A3B-MTP-GGUF:Q4_K_XL",
      "aliases": ["qwen-3.6", "qwen-3.6-35b-a3b"],
      "quantization": "UD-Q4_K_XL",
      "presets": ["local/titan-x-pascal/1x/general.ini"]
    },
    {
      "canonical_id": "unsloth/Qwen3.8-27B-GGUF:UD-Q6_K_XL",
      "discovery_id": "unsloth/Qwen3.8-27B-GGUF:Q6_K_XL",
      "aliases": ["qwen-3.8-27b"],
      "quantization": "UD-Q6_K_XL",
      "presets": ["8gb.ini", "12gb.ini", "12gb-pascal.ini", "96gb.ini", "aws/g6e/xlarge/general.ini", "aws/g6e/xlarge/qwen.ini", "aws/g6e/xlarge/qwen-27b.ini", "aws/g7e/2xlarge/general.ini", "aws/g7e/2xlarge/qwen.ini", "aws/g7e/2xlarge/qwen-27b.ini"]
    },
    {
      "canonical_id": "ornith-ai/Ornith-1.5-9B-GGUF:Q4_K_M",
      "discovery_id": "ornith-ai/Ornith-1.5-9B-GGUF:Q4_K_M",
      "aliases": ["ornith-1.5", "ornith-1.5-9b"],
      "quantization": "Q4_K_M",
      "presets": ["local/rtx-4060/1x/general.ini", "local/rtx-a2000-8gb/1x/general.ini", "local/gtx-1070-ti/1x/general.ini"]
    },
    {
      "canonical_id": "ornith-ai/Ornith-1.5-9B-GGUF:Q6_K",
      "discovery_id": "ornith-ai/Ornith-1.5-9B-GGUF:Q6_K",
      "aliases": ["ornith-1.5", "ornith-1.5-9b"],
      "quantization": "Q6_K",
      "presets": ["local/titan-x-pascal/1x/general.ini"]
    },
    {
      "canonical_id": "ornith-ai/Ornith-1.5-9B-GGUF:Q8_0",
      "discovery_id": "ornith-ai/Ornith-1.5-9B-GGUF:Q8_0",
      "aliases": ["ornith-1.5", "ornith-1.5-9b"],
      "quantization": "Q8_0",
      "presets": ["aws/g6/xlarge/general.ini", "aws/g6/xlarge/ornith-9b.ini", "aws/g6e/xlarge/general.ini", "aws/g6e/xlarge/ornith.ini", "aws/g6e/xlarge/ornith-9b.ini", "aws/g7e/2xlarge/general.ini", "aws/g7e/2xlarge/ornith.ini", "aws/g7e/2xlarge/ornith-9b.ini"]
    },
    {
      "canonical_id": "ornith-ai/Ornith-1.5-35B-A3B-GGUF:Q4_K_M",
      "discovery_id": "ornith-ai/Ornith-1.5-35B-A3B-GGUF:Q4_K_M",
      "aliases": ["ornith-1.5-35b-a3b"],
      "quantization": "Q4_K_M",
      "presets": ["local/titan-x-pascal/1x/general.ini"]
    },
    {
      "canonical_id": "ornith-ai/Ornith-1.5-35B-A3B-GGUF:Q8_0",
      "discovery_id": "ornith-ai/Ornith-1.5-35B-A3B-GGUF:Q8_0",
      "aliases": ["ornith-1.5-35b-a3b"],
      "quantization": "Q8_0",
      "presets": ["aws/g6e/xlarge/general.ini", "aws/g6e/xlarge/ornith.ini", "aws/g6e/xlarge/ornith-35b-a3b.ini", "aws/g7e/2xlarge/general.ini", "aws/g7e/2xlarge/ornith.ini", "aws/g7e/2xlarge/ornith-35b-a3b.ini"]
    },
    {
      "canonical_id": "ggml-org/NVIDIA-Nemotron-3.5-Lightning-30B-A3B-GGUF:Q4_0",
      "discovery_id": "ggml-org/NVIDIA-Nemotron-3.5-Lightning-30B-A3B-GGUF:Q4_0",
      "aliases": ["nemotron-3.5-lightning", "nemotron-3.5-lightning-30b-a3b"],